{
  "$schema": "https://json-schema.org/draft/2020-12/schema",
  "title": "harness",
  "description": "A project's harness.json (Implementation Decisions 1): the pin, autonomy, radius, the fallback consent, the ladder consent, budgets, reservations, pacing, notify, dashboard, policy overrides, docs theme.",
  "type": "object",
  "required": ["harness_tag", "autonomy", "radius"],
  "additionalProperties": false,
  "properties": {
    "harness_tag": {"type": "string", "pattern": "^v[0-9]+\\.[0-9]+\\.[0-9]+$"},
    "research_version": {"type": "integer", "minimum": 1, "description": "how research/ is kept (Implementation Decision 17): init writes the release's RESEARCH_VERSION; a project without the key is at 1"},
    "autonomy": {"type": "string", "enum": ["interactive", "checkpoints", "autonomous"]},
    "radius": {"type": "string", "enum": ["strict", "moderate", "exploratory"]},
    "model_fallback": {
      "type": "string",
      "enum": ["auto", "ask", "wait"],
      "description": "the fallback consent (Implementation Decisions 15): whether Fable work falls back to Opus while Fable's weekly window is spent; a project without the key behaves as ask"
    },
    "ladder_changes": {
      "type": "string",
      "enum": ["auto", "ask"],
      "description": "the ladder consent (Implementation Decisions 16): whether an autonomous run may change the rung ladder (tiers or difficulty) on its own; a project without the key behaves as ask"
    },
    "human_only": {
      "type": "array",
      "description": "the decision classes the decider never resolves (Implementation Decisions 4): goal and data always, plus the classes the owner added at intake",
      "items": {"type": "string", "pattern": "^[a-z][a-z0-9_-]*$"}
    },
    "budgets": {
      "type": "object",
      "additionalProperties": false,
      "properties": {
        "gpu_hours": {"type": ["number", "null"], "minimum": 0},
        "wallclock_hours": {"type": ["number", "null"], "minimum": 0},
        "usage_windows": {"type": ["integer", "null"], "minimum": 0}
      }
    },
    "reservations": {
      "type": "object",
      "additionalProperties": false,
      "properties": {
        "gpu": {"type": "array", "items": {"type": "integer", "minimum": 0}, "description": "GPU indices kept for the owner; empty means none"},
        "cores": {"type": "integer", "minimum": 0},
        "ram_gb": {"type": "number", "minimum": 0},
        "processes": {"type": "array", "items": {"type": "string"}, "description": "process names whose GPU memory and cores count as reserved"}
      }
    },
    "pacing": {
      "type": "object",
      "additionalProperties": false,
      "properties": {
        "stop_at": {"type": "number", "minimum": 0, "maximum": 1},
        "cheap_at": {"type": "number", "minimum": 0, "maximum": 1}
      }
    },
    "notify": {
      "type": "object",
      "additionalProperties": false,
      "properties": {
        "hermes_python": {"type": ["string", "null"], "description": "the interpreter that runs hermes_cli; null disables the Telegram channel"}
      }
    },
    "dashboard": {
      "type": "object",
      "additionalProperties": false,
      "properties": {
        "port": {"type": "integer", "minimum": 1, "maximum": 65535},
        "bind": {"type": "string"},
        "poll_journal_s": {"type": "number", "minimum": 0},
        "poll_views_s": {"type": "number", "minimum": 0}
      }
    },
    "policy": {"type": "object", "description": "overrides of policy.json keys, same shape"},
    "docs": {
      "type": "object",
      "additionalProperties": false,
      "description": "the documentation site (Implementation Decisions 13): the theme and layout chosen once per project by `wayline docs init`, the package the site documents, and the project's own environment Sphinx runs in",
      "properties": {
        "theme": {"type": "string", "description": "the Sphinx html_theme; docs/conf.py must name it"},
        "package": {"type": "string", "description": "the package directory the site documents, relative to the project (src/toy)"},
        "layout": {
          "type": "object",
          "additionalProperties": false,
          "required": ["tutorials", "how_to", "reference", "explanation", "gallery", "examples"],
          "properties": {
            "tutorials": {"type": "string"},
            "how_to": {"type": "string"},
            "reference": {"type": "string"},
            "explanation": {"type": "string"},
            "gallery": {"type": "string"},
            "examples": {"type": "string"}
          },
          "description": "each part of the site as a directory relative to the project, under docs/"
        },
        "python": {"type": ["string", "null"], "description": "the interpreter of the project's own environment Sphinx is installed in; absent or null is research/.cache/docs/venv, which wayline docs env creates"}
      }
    },
    "owner_email": {"type": ["string", "null"], "description": "sent in the scout's User-Agent to the polite pools"},
    "code_repository": {
      "type": "object",
      "additionalProperties": false,
      "description": "the code repository's record (Implementation Decision 17): what intake absorbed into code/, and the setup question's shape, remote, visibility, and license",
      "properties": {
        "shape": {"type": "string", "enum": ["package", "reproducibility"], "description": "a package of the developed method and every model the work applies it to, or a reproducibility repository of scripts, helpers, and the environment alone"},
        "visibility": {"type": "string", "enum": ["private", "public"], "description": "private until the owner's word makes it public, which is on the irreversible list"},
        "license": {"type": ["string", "null"], "description": "the SPDX id of the license the code repository carries"},
        "remote": {
          "type": ["object", "null"],
          "additionalProperties": false,
          "required": ["repository", "url", "how"],
          "properties": {
            "repository": {"type": "string", "pattern": "^[A-Za-z0-9_.-]+/[A-Za-z0-9_.-]+$", "description": "owner/name on GitHub"},
            "url": {"type": "string", "description": "what code pushes code/'s split to"},
            "how": {"type": "string", "enum": ["new", "copy", "owners_own"], "description": "a new private repository; a new private one carrying a taken-over repository's history, never a fork; or the owner's own repository, taken over on their word"},
            "confirmed_public": {"type": "boolean", "description": "the owner's one confirmation that their own public repository may be taken over"}
          }
        },
        "upstream": {
          "type": "object",
          "additionalProperties": false,
          "required": ["clone", "commit"],
          "description": "the project's own clone intake absorbed into code/ with git subtree add",
          "properties": {
            "clone": {"type": "string", "description": "where the clone is, its .git outside the project's tree"},
            "url": {"type": ["string", "null"], "description": "the clone's upstream remote"},
            "commit": {"type": "string", "pattern": "^[0-9a-f]{40}$", "description": "the commit absorbed"},
            "uncommitted": {"type": ["string", "null"], "description": "the project's commit carrying the clone's uncommitted changes, or null when it had none"},
            "license": {
              "type": ["object", "null"],
              "additionalProperties": false,
              "properties": {"file": {"type": "string"}, "spdx": {"type": ["string", "null"]}},
              "description": "the license the clone came with, or null without a license file"
            }
          }
        }
      }
    }
  }
}
